{
  "schema_version": 1,
  "request_id": "logical-action-001",
  "connection_id": "77777777-7777-4777-8777-777777777777",
  "resource_id": "88888888-8888-4888-8888-888888888888",
  "message": {
    "jsonrpc": "2.0",
    "id": "fixture-mcp-call",
    "method": "tools/call",
    "params": {
      "name": "get_stats",
      "arguments": {
        "campus": "north"
      }
    }
  }
}
